{"authority_unchanged":true,"calibration_report_hash":"sha256:ecc0d81457af4509a0a374b4af6300d69ace0f357436c1660e66c92a5deb9920","corpus_hash":"sha256:2e59a7255201afd97b73c41098749c582800e02d37ddc90cf90f51553fd614f8","detected_count":7,"false_negative_count":3,"harness_hash":"sha256:b9a1895c8a86ecb8f13ed260d77d559da5900f03a48152e09c41b62131ec298b","observation_count":20,"observations_hash":"sha256:24795b1c5b2ba6f119e601b0dea758bf91be0ba4c0b02a79b9498018fb46d5b5","runs":[{"authority_unchanged":true,"detected":false,"detector_id":"hard_invariant_auditor","detector_version":"M5.3","evidence_refs":[],"expected_gate":"hard_audit","expected_rule":"dead_actor","mutator_id":"KillThenAct","sample_id":"mutation_01_killthenact","terminal":"audit_passed","variant":"clean"},{"authority_unchanged":true,"detected":true,"detector_id":"hard_invariant_auditor","detector_version":"M5.3","evidence_refs":["hard-audit-report.json#finding_31d62a627012c3c4b7bf74ed"],"expected_gate":"hard_audit","expected_rule":"dead_actor","mutator_id":"KillThenAct","sample_id":"mutation_01_killthenact","terminal":"audit_failed","variant":"mutated"},{"authority_unchanged":true,"detected":false,"detector_id":"candidate_extractor","detector_version":"M5.1","evidence_refs":[],"expected_gate":"extraction","expected_rule":"unregistered_subject","mutator_id":"GhostCharacter","sample_id":"mutation_02_ghostcharacter","terminal":"extracted","variant":"clean"},{"authority_unchanged":true,"detected":true,"detector_id":"candidate_extractor","detector_version":"M5.1","evidence_refs":["exception:unregistered_subject"],"expected_gate":"extraction","expected_rule":"unregistered_subject","mutator_id":"GhostCharacter","sample_id":"mutation_02_ghostcharacter","terminal":"input_rejected","variant":"mutated"},{"authority_unchanged":true,"detected":false,"detector_id":"hard_invariant_auditor","detector_version":"M5.3","evidence_refs":[],"expected_gate":"hard_audit","expected_rule":"time_window","mutator_id":"TimeReversal","sample_id":"mutation_03_timereversal","terminal":"audit_passed","variant":"clean"},{"authority_unchanged":true,"detected":true,"detector_id":"hard_invariant_auditor","detector_version":"M5.3","evidence_refs":["hard-audit-report.json#finding_bc3fc6a04c7c0d5d228d28fa"],"expected_gate":"hard_audit","expected_rule":"time_window","mutator_id":"TimeReversal","sample_id":"mutation_03_timereversal","terminal":"audit_failed","variant":"mutated"},{"authority_unchanged":true,"detected":false,"detector_id":"hard_invariant_auditor","detector_version":"M5.3","evidence_refs":[],"expected_gate":"hard_audit","expected_rule":"knowledge_boundary","mutator_id":"KnowledgeLeak","sample_id":"mutation_04_knowledgeleak","terminal":"audit_passed","variant":"clean"},{"authority_unchanged":true,"detected":true,"detector_id":"hard_invariant_auditor","detector_version":"M5.3","evidence_refs":["hard-audit-report.json#finding_0b6a797a5923ae7106be5560"],"expected_gate":"hard_audit","expected_rule":"knowledge_boundary","mutator_id":"KnowledgeLeak","sample_id":"mutation_04_knowledgeleak","terminal":"audit_failed","variant":"mutated"},{"authority_unchanged":true,"detected":false,"detector_id":"semantic_audit","detector_version":"M5.4","evidence_refs":[],"expected_gate":"human_review","expected_rule":"persona_drift","mutator_id":"PersonaDrift","sample_id":"mutation_05_personadrift","terminal":"semantic_descriptive","variant":"clean"},{"authority_unchanged":true,"detected":false,"detector_id":"semantic_audit","detector_version":"M5.4","evidence_refs":[],"expected_gate":"human_review","expected_rule":"persona_drift","mutator_id":"PersonaDrift","sample_id":"mutation_05_personadrift","terminal":"semantic_descriptive","variant":"mutated"},{"authority_unchanged":true,"detected":false,"detector_id":"candidate_reconciler","detector_version":"M5.2","evidence_refs":[],"expected_gate":"reconcile","expected_rule":"intent_missing","mutator_id":"HookRemoval","sample_id":"mutation_06_hookremoval","terminal":"reconciled","variant":"clean"},{"authority_unchanged":true,"detected":true,"detector_id":"candidate_reconciler","detector_version":"M5.2","evidence_refs":["candidate-reconcile.json#intent_missing:char_lin_yun.status=exposed"],"expected_gate":"reconcile","expected_rule":"intent_missing","mutator_id":"HookRemoval","sample_id":"mutation_06_hookremoval","terminal":"reconcile_review","variant":"mutated"},{"authority_unchanged":true,"detected":false,"detector_id":"hard_invariant_auditor","detector_version":"M5.3","evidence_refs":[],"expected_gate":"hard_audit","expected_rule":"obligation_active","mutator_id":"ForeshadowGhost","sample_id":"mutation_07_foreshadowghost","terminal":"audit_passed","variant":"clean"},{"authority_unchanged":true,"detected":true,"detector_id":"hard_invariant_auditor","detector_version":"M5.3","evidence_refs":["hard-audit-report.json#finding_a17f1dcaa1e2115aebfb34c0"],"expected_gate":"hard_audit","expected_rule":"obligation_active","mutator_id":"ForeshadowGhost","sample_id":"mutation_07_foreshadowghost","terminal":"audit_failed","variant":"mutated"},{"authority_unchanged":true,"detected":false,"detector_id":"hard_invariant_auditor","detector_version":"M5.3","evidence_refs":[],"expected_gate":"hard_audit","expected_rule":"capability_prerequisite","mutator_id":"PowerJump","sample_id":"mutation_08_powerjump","terminal":"audit_passed","variant":"clean"},{"authority_unchanged":true,"detected":true,"detector_id":"hard_invariant_auditor","detector_version":"M5.3","evidence_refs":["hard-audit-report.json#finding_d1e292ef943ba37517da9460"],"expected_gate":"hard_audit","expected_rule":"capability_prerequisite","mutator_id":"PowerJump","sample_id":"mutation_08_powerjump","terminal":"audit_failed","variant":"mutated"},{"authority_unchanged":true,"detected":false,"detector_id":"style_audit_descriptive","detector_version":"M5.4","evidence_refs":[],"expected_gate":"calibrated_style","expected_rule":"trope_repeat","mutator_id":"TropeRepeat","sample_id":"mutation_09_troperepeat","terminal":"style_descriptive","variant":"clean"},{"authority_unchanged":true,"detected":false,"detector_id":"style_audit_descriptive","detector_version":"M5.4","evidence_refs":[],"expected_gate":"calibrated_style","expected_rule":"trope_repeat","mutator_id":"TropeRepeat","sample_id":"mutation_09_troperepeat","terminal":"style_descriptive","variant":"mutated"},{"authority_unchanged":true,"detected":false,"detector_id":"style_audit_descriptive","detector_version":"M5.4","evidence_refs":[],"expected_gate":"calibrated_style","expected_rule":"word_count_cheat","mutator_id":"WordCountCheat","sample_id":"mutation_10_wordcountcheat","terminal":"style_descriptive","variant":"clean"},{"authority_unchanged":true,"detected":false,"detector_id":"style_audit_descriptive","detector_version":"M5.4","evidence_refs":[],"expected_gate":"calibrated_style","expected_rule":"word_count_cheat","mutator_id":"WordCountCheat","sample_id":"mutation_10_wordcountcheat","terminal":"style_descriptive","variant":"mutated"}],"schema_version":"mutation-harness-report.v1"}